{"authority_profile_id":"rq03-live-managed-qualification-2026-10-09","controller_id":"rq03-live-qualification-controller","controller_implementation":"lesson-semantic-live-qualification-controller","controller_version":"1.0","created_at":"2026-10-09T11:30:00Z","evidence_repository_reference":"evidence_repository","ingress_procedure_reference":"ingress_procedure","operator_reference":"operator_reference","policy_epoch":1,"profile_version":"1.0","revoked_authority_ids":[],"roles":[{"allowed_roles":["author"],"authorization_reference":"role_auth_author","principal_id":"managed-agent:authoring-codex","revocation_reason":null,"revoked_at":null,"valid_from":"2026-10-09T11:00:00Z","valid_until":"2026-10-16T11:00:00Z"},{"allowed_roles":["scope_reviewer"],"authorization_reference":"role_auth_reviewer_a","principal_id":"managed-agent:scope-reviewer-a","revocation_reason":null,"revoked_at":null,"valid_from":"2026-10-09T11:00:00Z","valid_until":"2026-10-16T11:00:00Z"},{"allowed_roles":["qualification_approver","teacher_approver"],"authorization_reference":"role_auth_approver_b","principal_id":"managed-agent:qualification-approver-b","revocation_reason":null,"revoked_at":null,"valid_from":"2026-10-09T11:00:00Z","valid_until":"2026-10-16T11:00:00Z"},{"allowed_roles":["corpus_adjudicator"],"authorization_reference":"role_auth_corpus_adjudicator","principal_id":"owner-controller:corpus-adjudicator","revocation_reason":null,"revoked_at":null,"valid_from":"2026-10-09T11:00:00Z","valid_until":"2026-10-16T11:00:00Z"}]}